{
  "version": 4,
  "command": "review",
  "module": "authority",
  "identity_scheme": "nauqtype.semantic.v1",
  "functions": [
    {
      "id": "fn:authority::discard",
      "kind": "function",
      "qualified_name": "authority::discard",
      "module": "authority",
      "name": "discard",
      "public": true,
      "span": { "start": 80 },
      "audit": {
        "intent": "Own child cleanup without an explicit lifecycle call",
        "mutates": [],
        "effects": [
          "io"
        ],
        "propagates": []
      },
      "inferred": {
        "mutates": [],
        "effects": [
          "io"
        ],
        "propagates": [],
        "io_kinds": [
          "process"
        ]
      },
      "evidence": {
        "audit": "declared",
        "inferred": "checked",
        "mutation_coverage": {
          "interpretation": "syntactic_may_write",
          "scope": "checked_mutref_parameters",
          "completeness": "complete",
          "uncovered": []
        }
      },
      "calls": []
    },
    {
      "id": "fn:authority::discard_nested",
      "kind": "function",
      "qualified_name": "authority::discard_nested",
      "module": "authority",
      "name": "discard_nested",
      "public": true,
      "span": { "start": 230 },
      "audit": {
        "intent": "Own recursive aggregate cleanup authority",
        "mutates": [],
        "effects": [
          "io"
        ],
        "propagates": []
      },
      "inferred": {
        "mutates": [],
        "effects": [
          "io"
        ],
        "propagates": [],
        "io_kinds": [
          "process"
        ]
      },
      "evidence": {
        "audit": "declared",
        "inferred": "checked",
        "mutation_coverage": {
          "interpretation": "syntactic_may_write",
          "scope": "checked_mutref_parameters",
          "completeness": "complete",
          "uncovered": []
        }
      },
      "calls": []
    },
    {
      "id": "fn:authority::observe",
      "kind": "function",
      "qualified_name": "authority::observe",
      "module": "authority",
      "name": "observe",
      "public": true,
      "span": { "start": 396 },
      "audit": {
        "intent": "Borrowing a child alone grants no cleanup authority",
        "mutates": [],
        "effects": [],
        "propagates": []
      },
      "inferred": {
        "mutates": [],
        "effects": [],
        "propagates": []
      },
      "evidence": {
        "audit": "declared",
        "inferred": "checked",
        "mutation_coverage": {
          "interpretation": "syntactic_may_write",
          "scope": "checked_mutref_parameters",
          "completeness": "complete",
          "uncovered": []
        }
      },
      "calls": []
    },
    {
      "id": "fn:authority::observe_nested",
      "kind": "function",
      "qualified_name": "authority::observe_nested",
      "module": "authority",
      "name": "observe_nested",
      "public": true,
      "span": { "start": 547 },
      "audit": {
        "intent": "Borrow an aggregate without owning its child cleanup",
        "mutates": [],
        "effects": [],
        "propagates": []
      },
      "inferred": {
        "mutates": [],
        "effects": [],
        "propagates": []
      },
      "evidence": {
        "audit": "declared",
        "inferred": "checked",
        "mutation_coverage": {
          "interpretation": "syntactic_may_write",
          "scope": "checked_mutref_parameters",
          "completeness": "complete",
          "uncovered": []
        }
      },
      "calls": []
    },
    {
      "id": "fn:authority::forward",
      "kind": "function",
      "qualified_name": "authority::forward",
      "module": "authority",
      "name": "forward",
      "public": true,
      "span": { "start": 726 },
      "audit": {
        "intent": "Transfer child ownership explicitly",
        "mutates": [],
        "effects": [
          "io"
        ],
        "propagates": []
      },
      "inferred": {
        "mutates": [],
        "effects": [
          "io"
        ],
        "propagates": [],
        "io_kinds": [
          "process"
        ]
      },
      "evidence": {
        "audit": "declared",
        "inferred": "checked",
        "mutation_coverage": {
          "interpretation": "syntactic_may_write",
          "scope": "checked_mutref_parameters",
          "completeness": "complete",
          "uncovered": []
        }
      },
      "calls": []
    },
    {
      "id": "fn:authority::transitive",
      "kind": "function",
      "qualified_name": "authority::transitive",
      "module": "authority",
      "name": "transitive",
      "public": true,
      "span": { "start": 868 },
      "audit": {
        "intent": "Call an owner without claiming purity",
        "mutates": [],
        "effects": [
          "io"
        ],
        "propagates": []
      },
      "inferred": {
        "mutates": [],
        "effects": [
          "io"
        ],
        "propagates": [],
        "io_kinds": [
          "process"
        ]
      },
      "evidence": {
        "audit": "declared",
        "inferred": "checked",
        "mutation_coverage": {
          "interpretation": "syntactic_may_write",
          "scope": "checked_mutref_parameters",
          "completeness": "complete",
          "uncovered": []
        }
      },
      "calls": [
        {
          "id": "call:authority::transitive@988",
          "name": "discard",
          "target_kind": "function",
          "target_id": "fn:authority::discard",
          "target_module": "authority",
          "evidence": "checked",
          "span": { "start": 988 }
        }
      ]
    },
    {
      "id": "fn:authority::main",
      "kind": "function",
      "qualified_name": "authority::main",
      "module": "authority",
      "name": "main",
      "public": false,
      "span": { "start": 1018 },
      "audit": null,
      "inferred": {
        "mutates": [],
        "effects": [],
        "propagates": []
      },
      "evidence": {
        "audit": "absent",
        "inferred": "checked",
        "mutation_coverage": {
          "interpretation": "syntactic_may_write",
          "scope": "checked_mutref_parameters",
          "completeness": "complete",
          "uncovered": []
        }
      },
      "calls": []
    }
  ],
  "references": [
    {
      "id": "call:authority::transitive@988",
      "kind": "call",
      "from": "fn:authority::transitive",
      "name": "discard",
      "target_kind": "function",
      "target_id": "fn:authority::discard",
      "evidence": "checked",
      "span": { "start": 988 }
    }
  ],
  "call_graph": [
    {
      "caller": "fn:authority::transitive",
      "callee": "fn:authority::discard",
      "call_site": "call:authority::transitive@988",
      "evidence": "checked"
    }
  ],
  "propagation_sites": []
}
